{
  "contractVersion": "0.1.0",
  "kind": "form",
  "id": "sales-order:approve-sales-order",
  "title": "Approve Sales Order",
  "purpose": "execute-command",
  "command": {
    "code": "approve-sales-order",
    "inputVersion": "1.0.0"
  },
  "fields": [
    {
      "key": "orderNo",
      "label": "Order No",
      "semanticType": "Text",
      "control": "text",
      "required": true
    },
    {
      "key": "customer",
      "label": "Customer",
      "semanticType": "CustomerRef",
      "control": "reference",
      "required": true
    },
    {
      "key": "productId",
      "label": "Product",
      "semanticType": "ItemRef",
      "control": "reference",
      "required": true
    },
    {
      "key": "quantity",
      "label": "Quantity",
      "semanticType": "Quantity",
      "control": "number",
      "required": true,
      "unit": "EA",
      "validation": {
        "min": 1
      }
    },
    {
      "key": "unitPrice",
      "label": "Unit Price",
      "semanticType": "Money",
      "control": "money",
      "required": true,
      "validation": {
        "min": 0
      }
    },
    {
      "key": "currency",
      "label": "Currency",
      "semanticType": "Currency",
      "control": "select",
      "required": true,
      "options": [
        {
          "value": "USD",
          "label": "USD"
        },
        {
          "value": "SGD",
          "label": "SGD"
        }
      ]
    },
    {
      "key": "fulfillmentMode",
      "label": "Fulfillment Mode",
      "semanticType": "Enum",
      "control": "select",
      "required": true,
      "options": [
        {
          "value": "MAKE",
          "label": "Make"
        },
        {
          "value": "BUY",
          "label": "Buy"
        },
        {
          "value": "STOCK",
          "label": "Stock"
        }
      ]
    }
  ],
  "actions": [
    {
      "id": "submit",
      "label": "Approve Sales Order",
      "type": "submit",
      "command": "approve-sales-order",
      "requiresConfirmation": true
    }
  ],
  "metadata": {
    "sourceApplication": "sales-order",
    "sourceContract": "1.0.0"
  }
}
